{
  "$schema": "https://github.com/777genius/universal-agent-plugins/schemas/catalog-v2.schema.json",
  "schema_version": 2,
  "catalog_version": "0.2.0",
  "repository": "777genius/universal-agent-plugins",
  "revision": "2ddbb99dd190c1792b79904f9875e6322bccd243",
  "published_at": "2026-08-09T22:28:33Z",
  "plugins": [
    {
      "name": "agent-code-navigator",
      "version": "0.1.0",
      "agent_plugins_schema": "https://agent-plugins.org/schemas/1.0.0/plugin.schema.json",
      "minimum_cli_version": "0.1.0",
      "source_path": "plugins/agent-code-navigator",
      "tree_digest": "sha256:2da970986164b2ba56aee452205bb2312927814f66596653b248c127e4e767e0",
      "manifest_digest": "sha256:675fb48dff9431f75e2986211039b3bfb04860a84d6a5bd157b9658514a2394e",
      "components": [
        "skills"
      ],
      "compatibility": {
        "codex": {
          "package": "projected",
          "verification": "tested",
          "authentication": "not_required"
        },
        "cursor": {
          "package": "native",
          "verification": "tested",
          "authentication": "not_required"
        },
        "copilot": {
          "package": "native",
          "verification": "schema_only",
          "authentication": "not_required"
        },
        "vscode": {
          "package": "prepared",
          "verification": "schema_only",
          "authentication": "not_required"
        },
        "kiro": {
          "package": "native",
          "verification": "tested",
          "authentication": "not_required"
        }
      }
    },
    {
      "name": "atlassian",
      "version": "0.1.0",
      "agent_plugins_schema": "https://agent-plugins.org/schemas/1.0.0/plugin.schema.json",
      "minimum_cli_version": "0.1.0",
      "source_path": "plugins/atlassian",
      "tree_digest": "sha256:a5988dbe73fa2efa8892a3918aabc6273a8398d56f3d247e7e921fdb1ee8a167",
      "manifest_digest": "sha256:e83ade754f1251554622e4b48d596ebf72510bd7292b19a7793df4de8e546d04",
      "components": [
        "mcp"
      ],
      "compatibility": {
        "codex": {
          "package": "projected",
          "verification": "schema_only",
          "authentication": "required"
        },
        "cursor": {
          "package": "native",
          "verification": "schema_only",
          "authentication": "required"
        },
        "copilot": {
          "package": "native",
          "verification": "schema_only",
          "authentication": "required"
        },
        "vscode": {
          "package": "prepared",
          "verification": "schema_only",
          "authentication": "required"
        },
        "kiro": {
          "package": "native",
          "verification": "schema_only",
          "authentication": "required"
        }
      }
    },
    {
      "name": "chrome-devtools",
      "version": "0.1.0",
      "agent_plugins_schema": "https://agent-plugins.org/schemas/1.0.0/plugin.schema.json",
      "minimum_cli_version": "0.1.0",
      "source_path": "plugins/chrome-devtools",
      "tree_digest": "sha256:07cae09debbcd3f4ab7c18ef00db5fba58b0185b2c502d759732155e47a65f7b",
      "manifest_digest": "sha256:e7d43a8e39b0e83f2c05777e297f6a3884002dc2601d70528b55a44132db8091",
      "components": [
        "mcp"
      ],
      "compatibility": {
        "codex": {
          "package": "projected",
          "verification": "tested",
          "authentication": "not_required"
        },
        "cursor": {
          "package": "native",
          "verification": "tested",
          "authentication": "not_required"
        },
        "copilot": {
          "package": "native",
          "verification": "schema_only",
          "authentication": "not_required"
        },
        "vscode": {
          "package": "prepared",
          "verification": "schema_only",
          "authentication": "not_required"
        },
        "kiro": {
          "package": "native",
          "verification": "tested",
          "authentication": "not_required"
        }
      }
    },
    {
      "name": "cloudflare",
      "version": "0.1.0",
      "agent_plugins_schema": "https://agent-plugins.org/schemas/1.0.0/plugin.schema.json",
      "minimum_cli_version": "0.1.0",
      "source_path": "plugins/cloudflare",
      "tree_digest": "sha256:788761d3f9da6d95d7ab8c6253942f057ecef5e0fb8e2815fbca8dcbb5fcee40",
      "manifest_digest": "sha256:9bec7cfed2ecb217145c2a02658296670a328416566433518b4da0246e91d382",
      "components": [
        "mcp"
      ],
      "compatibility": {
        "codex": {
          "package": "projected",
          "verification": "schema_only",
          "authentication": "required"
        },
        "cursor": {
          "package": "native",
          "verification": "schema_only",
          "authentication": "required"
        },
        "copilot": {
          "package": "native",
          "verification": "schema_only",
          "authentication": "required"
        },
        "vscode": {
          "package": "prepared",
          "verification": "schema_only",
          "authentication": "required"
        },
        "kiro": {
          "package": "native",
          "verification": "schema_only",
          "authentication": "required"
        }
      }
    },
    {
      "name": "cloudflare-bindings",
      "version": "0.1.0",
      "agent_plugins_schema": "https://agent-plugins.org/schemas/1.0.0/plugin.schema.json",
      "minimum_cli_version": "0.1.0",
      "source_path": "plugins/cloudflare-bindings",
      "tree_digest": "sha256:98573830f703a479dece5bb964353117151e533abff0fa77597c5a654dc56729",
      "manifest_digest": "sha256:6b945cf035f784216e71425cf7b6ca477b27a2069d2580e9713a65f5ec2ca0bf",
      "components": [
        "mcp"
      ],
      "compatibility": {
        "codex": {
          "package": "projected",
          "verification": "schema_only",
          "authentication": "required"
        },
        "cursor": {
          "package": "native",
          "verification": "schema_only",
          "authentication": "required"
        },
        "copilot": {
          "package": "native",
          "verification": "schema_only",
          "authentication": "required"
        },
        "vscode": {
          "package": "prepared",
          "verification": "schema_only",
          "authentication": "required"
        },
        "kiro": {
          "package": "native",
          "verification": "schema_only",
          "authentication": "required"
        }
      }
    },
    {
      "name": "cloudflare-docs",
      "version": "0.1.0",
      "agent_plugins_schema": "https://agent-plugins.org/schemas/1.0.0/plugin.schema.json",
      "minimum_cli_version": "0.1.0",
      "source_path": "plugins/cloudflare-docs",
      "tree_digest": "sha256:ebfc3239ab774dea35897919362f4ca0b2b3bfc6d33863d977940ab493907b74",
      "manifest_digest": "sha256:6b575562e527194ccd31238fde8c5f764409ecc98e211e92dfb81455eef88bdd",
      "components": [
        "mcp"
      ],
      "compatibility": {
        "codex": {
          "package": "projected",
          "verification": "tested",
          "authentication": "not_required"
        },
        "cursor": {
          "package": "native",
          "verification": "tested",
          "authentication": "not_required"
        },
        "copilot": {
          "package": "native",
          "verification": "schema_only",
          "authentication": "not_required"
        },
        "vscode": {
          "package": "prepared",
          "verification": "schema_only",
          "authentication": "not_required"
        },
        "kiro": {
          "package": "native",
          "verification": "tested",
          "authentication": "not_required"
        },
        "chatgpt": {
          "package": "projected",
          "verification": "tested",
          "authentication": "not_required",
          "app_binding": {
            "app_key": "cloudflare-docs",
            "id": "plugin_asdk_app_6a78e90cf73481918ef10cdb87cd4bb4",
            "mcp_server": "cloudflare-docs",
            "mcp_url": "https://docs.mcp.cloudflare.com/mcp",
            "runtime_evidence": "tests/e2e/results/chatgpt-cloudflare-docs-personal-app-2026-08-10.json",
            "runtime_evidence_revision": "2ddbb99dd190c1792b79904f9875e6322bccd243"
          }
        }
      }
    },
    {
      "name": "cloudflare-observability",
      "version": "0.1.0",
      "agent_plugins_schema": "https://agent-plugins.org/schemas/1.0.0/plugin.schema.json",
      "minimum_cli_version": "0.1.0",
      "source_path": "plugins/cloudflare-observability",
      "tree_digest": "sha256:dbabe94312d1d780f6f96c6f9c595cb46dbdef49ce31182906c3cc4077e4b295",
      "manifest_digest": "sha256:41573bb020202619d72fe2cbbf35c56cb5ed4b885b17867ffd2e4a74ebcb5064",
      "components": [
        "mcp"
      ],
      "compatibility": {
        "codex": {
          "package": "projected",
          "verification": "schema_only",
          "authentication": "required"
        },
        "cursor": {
          "package": "native",
          "verification": "schema_only",
          "authentication": "required"
        },
        "copilot": {
          "package": "native",
          "verification": "schema_only",
          "authentication": "required"
        },
        "vscode": {
          "package": "prepared",
          "verification": "schema_only",
          "authentication": "required"
        },
        "kiro": {
          "package": "native",
          "verification": "schema_only",
          "authentication": "required"
        }
      }
    },
    {
      "name": "cloudflare-radar",
      "version": "0.1.0",
      "agent_plugins_schema": "https://agent-plugins.org/schemas/1.0.0/plugin.schema.json",
      "minimum_cli_version": "0.1.0",
      "source_path": "plugins/cloudflare-radar",
      "tree_digest": "sha256:bad20c22343458ad40d08b48d621db32955b07ab66d61ad02cc0546a4e5e94c6",